System,Ticket Number,Incident Name,Seriousity,Date,Status,Short Comment,Summary,Comments
SAP,INC0268596,Calc run issue,s1,2/7/2017,In-progress,Working with calc team,"Due to incorrect cost element invoice, running settlement for 101029.IE10.CP001 WBS element is not posible, so please could you please add Account 700001 for Capex WBS element settlement.P&L impact $ 31582.82","12/23 :FFID Requested , awaited approvals\n12/26: Transferred the balance from old WBS to dummy amount, but due to exchange rate difference little baance left in old element. Team looking for options to knock it."
RevStream,INC0263538,SPP Workbench Issue,s4,2/4/2017,Completed,Issue is fixed,"SPP Redemption's failing, to load to SPP workbench","12/23 : Datafix in progress.\n12/26 : business validating the fix, in lower instance"
RevStream,INC0268596,Calc run issue,s1,2/3/2017,In-progress,Working with Dev team,"Due to incorrect cost element invoice, running settlement for 101029.IE10.CP001 WBS element is not posible, so please could you please add Account 700001 for Capex WBS element settlement.P&L impact $ 31582.82","12/23 :FFID Requested , awaited approvals\n12/26: Transferred the balance from old WBS to dummy amount, but due to exchange rate difference little baance left in old element. Team looking for options to knock it."
Hyperion,INC0263538,Hyperion Load issue,s2,2/7/2017,Completed,Issue is fixed,"SPP Redemption's failing, to load to SPP workbench","12/23 : Datafix in progress.\n12/26 : business validating the fix, in lower instance"
SAP,INC0268596,Calc run issue,s1,2/10/2017,In-progress,Working with BTA team for the Setup,"Due to incorrect cost element invoice, running settlement for 101029.IE10.CP001 WBS element is not posible, so please could you please add Account 700001 for Capex WBS element settlement.P&L impact $ 31582.82","12/23 :FFID Requested , awaited approvals\n12/26: Transferred the balance from old WBS to dummy amount, but due to exchange rate difference little baance left in old element. Team looking for options to knock it."
SAP BI,INC0273095,SAP BI,s3,2/9/2017,Completed,Issue is fixed,"Users were unable to get data from BOBJ reports and BODS Scheduled jobs were failing. Hana BP1 exceeded the memory usage and it went to Hung status.","12/23 : Datafix in progress.\n12/26 : business validating the fix, in lower instance"
Webflash,INC0268596,Calc run issue,s1,2/7/2017,In-progress,Working with calc team,"Due to incorrect cost element invoice, running settlement for 101029.IE10.CP001 WBS element is not posible, so please could you please add Account 700001 for Capex WBS element settlement.P&L impact $ 31582.82","12/23 :FFID Requested , awaited approvals\n12/26: Transferred the balance from old WBS to dummy amount, but due to exchange rate difference little baance left in old element. Team looking for options to knock it."
System & General,INC0263538,SAP BI,s4,2/7/2017,Completed,Issue is fixed,"Users are unable to login to BI via Horizon Workspace. They are encountering a 403 - Forbidden error","12/23 : Datafix in progress.\n12/26 : business validating the fix, in lower instance"
